{
  "id": "a1b2c3d4-e5f6-7890-abcd-ef1234567890",
  "title": "Team Standup",
  "start": "2026-03-24T09:00:00Z",
  "end": "2026-03-24T09:30:00Z",
  "description": "Daily standup meeting for the engineering team.",
  "location": "Conference Room B",
  "all_day": false,
  "recurrence": {
    "frequency": "weekly",
    "interval": 1,
    "until": "2026-12-31T23:59:59Z",
    "count": 50,
    "by_day": ["MO", "TU", "WE", "TH", "FR"]
  },
  "attendees": [
    {
      "name": "Alice Smith",
      "email": "alice@example.com",
      "status": "accepted"
    },
    {
      "name": "Bob Jones",
      "email": "bob@example.com",
      "status": "tentative"
    }
  ],
  "reminders": [
    {
      "minutes_before": 10,
      "method": "notification"
    },
    {
      "minutes_before": 60,
      "method": "email"
    }
  ],
  "timezone": "America/New_York",
  "status": "confirmed",
  "source": "google-calendar",
  "source_id": "gcal-evt-12345",
  "extensions": {
    "com.example.weather": {
      "forecast": "sunny",
      "temperature_c": 22
    }
  },
  "created_at": "2026-03-20T12:00:00Z",
  "updated_at": "2026-03-23T08:30:00Z"
}
